Nume,CodFiscal,Judet,Telefon,CifraDeAfaceriNetaRON2021,ProfitNetRON2021,CotaDePiata2021,CodCAEN2021,DescriereCodCAEN2021,Salariati2020,CifraDeAfaceriNetaRON2020,ProfitNetRON2020,CotaDePiata2020,CodCAEN2020,DescriereCodCAEN2020,Salariati2019,CifraDeAfaceriNetaRON2019,ProfitNetRON2019,CotaDePiata2019,CodCAEN2019,DescriereCodCAEN2019,Salariati2018,CifraDeAfaceriNetaRON2018,ProfitNetRON2018,CotaDePiata2018,CodCAEN2018,DescriereCodCAEN2018
CAMA DIGITAL TECH SRL,39996402,MUREŞ,0741573940,116715,42721,0%,6201,Activitati de realizare a software-ului la comanda (software orientat client),0.0,125645.0,40200.0,0%,6201.0,Activitati de realizare a software-ului la comanda (software orientat client),0.0,0.0,0.0,0%,6201.0,Activitati de realizare a software-ului la comanda (software orientat client),nan,nan,nan,nan,nan,nan
S.C. HORIVEZ ATLAS RISTORANTE SRL,39998632,SIBIU,-,0,0,0%,5610,Restaurante,2.0,0.0,0.0,0%,5610.0,Restaurante,1.0,0.0,0.0,0%,5610.0,Restaurante,nan,nan,nan,nan,nan,nan
CONI REZIDENT CONSTRUCT,39998608,SIBIU,0747342504,180000,87,0%,4120,Lucrari de constructie a cladirilor rezidentiale si nerezidentiale,6.0,196430.0,103.0,0%,4120.0,Lucrari de constructie a cladirilor rezidentiale si nerezidentiale,3.0,63300.0,2790.0,0%,4120.0,Lucrari de constructie a cladirilor rezidentiale si nerezidentiale,nan,nan,nan,nan,nan,nan
SUZZY HOUSE SRL,40007350,ALBA,-,0,0,0%,9604,Activitati de întretinere corporala,4.0,0.0,0.0,0%,9604.0,Activitati de întretinere corporala,2.0,0.0,0.0,0%,9604.0,Activitati de întretinere corporala,nan,nan,nan,nan,nan,nan
SC CHIS GARAGE ASSIST SRL,40007334,ALBA,-,0,0,0%,4520,Întretinerea si repararea autovehiculelor,0.0,0.0,0.0,0%,4520.0,Întretinerea si repararea autovehiculelor,nan,nan,nan,nan,nan,nan,nan,nan,nan,nan,nan,nan
INTER FOOD BOX,40011653,BRAŞOV,-,1064951,375610,0.01%,5610,Restaurante,17.0,763798.0,193192.0,0.01%,5610.0,Restaurante,11.0,1356818.0,315454.0,0.01%,5610.0,Restaurante,1.0,58849.0,26951.0,0%,5610.0,Restaurante
MANA FEED SRL,40014412,ALBA,-,475520,0,0%,5610,Restaurante,0.0,0.0,0.0,0%,5610.0,Restaurante,1.0,0.0,0.0,0%,5610.0,Restaurante,1.0,0.0,0.0,0%,5610.0,Restaurante
SC BIOPAN ADRIAN S.R.L,40020074,ALBA,-,71274,0,0.04%,1073,"Fabricarea macaroanelor, taiteilor, cus-cus-ului si a altor produse fainoase similare",4.0,13181.0,0.0,0.01%,1073.0,"Fabricarea macaroanelor, taiteilor, cus-cus-ului si a altor produse fainoase similare",0.0,0.0,0.0,0%,1073.0,"Fabricarea macaroanelor, taiteilor, cus-cus-ului si a altor produse fainoase similare",nan,nan,nan,nan,nan,nan
LA BUCATARUL VESEL SRL,40024513,BRAŞOV,0753335633,307995,48029,0.02%,1089,Fabricarea altor produse alimentare n.c.a.,6.0,178133.0,0.0,0.01%,1089.0,Fabricarea altor produse alimentare n.c.a.,0.0,0.0,0.0,0%,1089.0,Fabricarea altor produse alimentare n.c.a.,0.0,0.0,0.0,0%,1089.0,Fabricarea altor produse alimentare n.c.a.
ECO SOURCE POPA SRL,40036380,ALBA,-,0,0,0%,1629,"Fabricarea altor produse din lemn; fabricarea articolelor din pluta, paie si din alte materiale vegetale împletite",0.0,0.0,0.0,0%,1629.0,"Fabricarea altor produse din lemn; fabricarea articolelor din pluta, paie si din alte materiale vegetale împletite",0.0,0.0,0.0,0%,1629.0,"Fabricarea altor produse din lemn; fabricarea articolelor din pluta, paie si din alte materiale vegetale împletite",0.0,0.0,0.0,0%,1629.0,"Fabricarea altor produse din lemn; fabricarea articolelor din pluta, paie si din alte materiale vegetale împletite"
BIVOCAPRI FARM SRL,40036372,ALBA,-,0,0,0%,1051,Fabricarea produselor lactate si a brânzeturilor,0.0,0.0,0.0,0%,1051.0,Fabricarea produselor lactate si a brânzeturilor,0.0,0.0,0.0,0%,1051.0,Fabricarea produselor lactate si a brânzeturilor,0.0,0.0,0.0,0%,1051.0,Fabricarea produselor lactate si a brânzeturilor
S.C.SMART FIZIO SRL,40050350,MUREŞ,0742671786,150692,0,0%,8690,Alte activitati referitoare la sanatatea umana,5.0,70995.0,0.0,0%,8690.0,Alte activitati referitoare la sanatatea umana,1.0,16330.0,0.0,0%,8690.0,Alte activitati referitoare la sanatatea umana,1.0,0.0,0.0,0%,8690.0,Alte activitati referitoare la sanatatea umana
SC COFETARIA APOLZAN SRL,40062010,ALBA,-,706075,46348,0.01%,1071,Fabricarea pâinii; fabricarea prajiturilor si a produselor proaspete de patiserie,8.0,494855.0,55450.0,0.01%,1071.0,Fabricarea pâinii; fabricarea prajiturilor si a produselor proaspete de patiserie,8.0,336649.0,6877.0,0%,1071.0,Fabricarea pâinii; fabricarea prajiturilor si a produselor proaspete de patiserie,0.0,0.0,0.0,0%,1071.0,Fabricarea pâinii; fabricarea prajiturilor si a produselor proaspete de patiserie
S.C. CANISMAJORIS21 SRL,40065637,BRAŞOV,-,6868,4523,0%,1073,"Fabricarea macaroanelor, taiteilor, cus-cus-ului si a altor produse fainoase similare",0.0,439.0,0.0,0%,1073.0,"Fabricarea macaroanelor, taiteilor, cus-cus-ului si a altor produse fainoase similare",0.0,0.0,0.0,0%,1073.0,"Fabricarea macaroanelor, taiteilor, cus-cus-ului si a altor produse fainoase similare",0.0,0.0,0.0,0%,1073.0,"Fabricarea macaroanelor, taiteilor, cus-cus-ului si a altor produse fainoase similare"
S.C. TRANSYLVANIA GREENBERRY S.R.L.,40067123,ALBA,-,109213,0,0.15%,1032,Fabricarea sucurilor de fructe si legume,5.0,72703.0,0.0,0.1%,1032.0,Fabricarea sucurilor de fructe si legume,0.0,373.0,392.0,0%,1032.0,Fabricarea sucurilor de fructe si legume,nan,nan,nan,nan,nan,nan
WORTEXCLEANING SRL,40069205,ALBA,0743819495,220466,73123,0%,4619,Intermedieri în comertul cu produse diverse,5.0,81598.0,0.0,0%,4619.0,Intermedieri în comertul cu produse diverse,0.0,34651.0,181.0,0%,4619.0,Intermedieri în comertul cu produse diverse,0.0,6305.0,301.0,0%,4619.0,Intermedieri în comertul cu produse diverse
SST GRUP TRANSILVANIA CONSULTANTA SRL,40070366,MUREŞ,-,145000,0,0.03%,7021,Activitati de consultanta în domeniul relatiilor publice si al comunicarii,5.0,97000.0,79599.0,0.02%,7021.0,Activitati de consultanta în domeniul relatiilor publice si al comunicarii,1.0,200.0,0.0,0%,7021.0,Activitati de consultanta în domeniul relatiilor publice si al comunicarii,nan,nan,nan,nan,nan,nan
ARMONIA KINDERKLUB SRL,40071701,SIBIU,0744958982,5488,0,0%,8559,Alte forme de învatamânt n.c.a.,0.0,5965.0,0.0,0%,8559.0,Alte forme de învatamânt n.c.a.,0.0,12818.0,0.0,0%,8559.0,Alte forme de învatamânt n.c.a.,nan,nan,nan,nan,nan,nan
SC FOODEDIL DRL,40076539,ALBA,-,0,4464,0%,1071,Fabricarea pâinii; fabricarea prajiturilor si a produselor proaspete de patiserie,1.0,0.0,0.0,0%,1071.0,Fabricarea pâinii; fabricarea prajiturilor si a produselor proaspete de patiserie,1.0,31276.0,0.0,0%,1071.0,Fabricarea pâinii; fabricarea prajiturilor si a produselor proaspete de patiserie,1.0,0.0,0.0,0%,1071.0,Fabricarea pâinii; fabricarea prajiturilor si a produselor proaspete de patiserie
ART OF IRON DOV SRL,40085537,MUREŞ,-,109160,0,0%,2511,Fabricarea de constructii metalice si parti componente ale structurilor metalice,2.0,6000.0,0.0,0%,2511.0,Fabricarea de constructii metalice si parti componente ale structurilor metalice,0.0,0.0,0.0,0%,2511.0,Fabricarea de constructii metalice si parti componente ale structurilor metalice,0.0,0.0,0.0,0%,2511.0,Fabricarea de constructii metalice si parti componente ale structurilor metalice
STUDIO POEMI SRL,40086591,SIBIU,0766879397,437193,103561,0.1%,2341,Fabricarea articolelor ceramice pentru uz gospodaresc si ornamental,5.0,212221.0,0.0,0.05%,2341.0,Fabricarea articolelor ceramice pentru uz gospodaresc si ornamental,4.0,69754.0,0.0,0.02%,2341.0,Fabricarea articolelor ceramice pentru uz gospodaresc si ornamental,0.0,0.0,0.0,0%,2341.0,Fabricarea articolelor ceramice pentru uz gospodaresc si ornamental
PRIVATE MAINTENANCE END CLEANING SRL,40088959,BRAŞOV,07455214139,43370,0,0%,8121,Activitati generale (nespecializate) de curatenie interioara a cladirilor,3.0,43890.0,0.0,0%,8121.0,Activitati generale (nespecializate) de curatenie interioara a cladirilor,4.0,19698.0,127698.0,0%,8121.0,Activitati generale (nespecializate) de curatenie interioara a cladirilor,0.0,1407.0,0.0,0%,8121.0,Activitati generale (nespecializate) de curatenie interioara a cladirilor
Flavixtreme S.r.l,40100157,MUREŞ,-,160109,12554,0.04%,9313,Activitati ale centrelor de fitness,5.0,26176.0,0.0,0.01%,9313.0,Activitati ale centrelor de fitness,3.0,2787.0,0.0,0%,9313.0,Activitati ale centrelor de fitness,0.0,0.0,0.0,0%,9313.0,Activitati ale centrelor de fitness
BEST GARDEN TRANSILVANIA SRL,40100173,MUREŞ,-,113034,0,0.01%,8130,Activitati de întretinere peisagistica,2.0,37780.0,0.0,0%,8130.0,Activitati de întretinere peisagistica,1.0,9944.0,0.0,0%,8130.0,Activitati de întretinere peisagistica,0.0,22755.0,18193.0,0%,8130.0,Activitati de întretinere peisagistica
S.C. BODY FIT CODLEA S.R.L.,40101160,SIBIU,0763693759,148998,0,0.04%,9313,Activitati ale centrelor de fitness,1.0,0.0,0.0,0%,9313.0,Activitati ale centrelor de fitness,nan,nan,nan,nan,nan,nan,nan,nan,nan,nan,nan,nan
S.C. SERVDECURATENIEECO SRL,40105634,ALBA,-,20000,4366,0%,8121,Activitati generale (nespecializate) de curatenie interioara a cladirilor,3.0,0.0,0.0,0%,8121.0,Activitati generale (nespecializate) de curatenie interioara a cladirilor,nan,nan,nan,nan,nan,nan,nan,nan,nan,nan,nan,nan
MOFT CONTRACTER  SRL,40107503,BRAŞOV,0743583698,649783,30015,0.01%,3109,Fabricarea de mobila n.c.a.,3.0,462011.0,41535.0,0%,3109.0,Fabricarea de mobila n.c.a.,1.0,80894.0,69673.0,0%,3109.0,Fabricarea de mobila n.c.a.,nan,nan,nan,nan,nan,nan
S.C. IONVLAD PROD SRL,40107490,BRAŞOV,-,0,0,0%,1089,Fabricarea altor produse alimentare n.c.a.,2.0,11099.0,0.0,0%,1089.0,Fabricarea altor produse alimentare n.c.a.,0.0,0.0,0.0,0%,1089.0,Fabricarea altor produse alimentare n.c.a.,nan,nan,nan,nan,nan,nan
S.C BALEA RENTALS S.R.L.,40114306,SIBIU,-,6600,0,0%,4312,Lucrari de pregatire a terenului,5.0,13480.0,0.0,0%,4312.0,Lucrari de pregatire a terenului,3.0,13500.0,0.0,0%,7732.0,Activitati de închiriere si leasing de masini si echipamente pentru constructii,nan,nan,nan,nan,nan,nan
S.C. SORIN CIBU CONSTRUCT SRL,40117825,ALBA,-,427731,23291,0%,4120,Lucrari de constructie a cladirilor rezidentiale si nerezidentiale,6.0,335940.0,18411.0,0%,4120.0,Lucrari de constructie a cladirilor rezidentiale si nerezidentiale,5.0,78242.0,19601.0,0%,4120.0,Lucrari de constructie a cladirilor rezidentiale si nerezidentiale,nan,nan,nan,nan,nan,nan
SWEET MINI PROD SRL,40120286,ALBA,-,0,15557,0%,1085,Fabricarea de mâncaruri preparate,4.0,0.0,10051.0,0%,1085.0,Fabricarea de mâncaruri preparate,1.0,0.0,0.0,0%,1085.0,Fabricarea de mâncaruri preparate,nan,nan,nan,nan,nan,nan
LA POIATA RETREAT SRL,40121311,MUREŞ,-,33581,0,0%,5520,Facilitati de cazare pentru vacante si perioade de scurta durata,4.0,61592.0,10969.0,0.01%,5520.0,Facilitati de cazare pentru vacante si perioade de scurta durata,0.0,0.0,0.0,0%,5520.0,Facilitati de cazare pentru vacante si perioade de scurta durata,nan,nan,nan,nan,nan,nan
Pane E Cioccolato SRL,40121680,BRAŞOV,0770551004,345854,1638,0%,1071,Fabricarea pâinii; fabricarea prajiturilor si a produselor proaspete de patiserie,3.0,282418.0,0.0,0%,1071.0,Fabricarea pâinii; fabricarea prajiturilor si a produselor proaspete de patiserie,1.0,0.0,0.0,0%,1071.0,Fabricarea pâinii; fabricarea prajiturilor si a produselor proaspete de patiserie,nan,nan,nan,nan,nan,nan
CONSTANTIN FOODPROD SRL,40123878,ALBA,-,0,0,0%,1085,Fabricarea de mâncaruri preparate,1.0,0.0,0.0,0%,1085.0,Fabricarea de mâncaruri preparate,0.0,0.0,0.0,0%,5610.0,Restaurante,nan,nan,nan,nan,nan,nan
UTILEXFIL CONS SRL,40123916,ALBA,-,231659,43167,0.02%,4312,Lucrari de pregatire a terenului,5.0,275943.0,78040.0,0.02%,4312.0,Lucrari de pregatire a terenului,3.0,33500.0,0.0,0%,4312.0,Lucrari de pregatire a terenului,nan,nan,nan,nan,nan,nan
BOUTIQUE BY DENY SRL,40126505,ALBA,-,28350,0,0.01%,9604,Activitati de întretinere corporala,4.0,0.0,0.0,0%,9604.0,Activitati de întretinere corporala,1.0,0.0,0.0,0%,9604.0,Activitati de întretinere corporala,nan,nan,nan,nan,nan,nan
CLINICA DENTARA FILIMON,40132825,ALBA,-,440910,212496,0.01%,8623,Activitati de asistenta stomatologica,4.0,246204.0,88529.0,0.01%,8623.0,Activitati de asistenta stomatologica,1.0,48580.0,0.0,0%,8623.0,Activitati de asistenta stomatologica,0.0,0.0,0.0,0%,8623.0,Activitati de asistenta stomatologica
BSB DAL GROUP SRL,40135759,MUREŞ,0740198796,472343,2661,0.05%,2312,Prelucrarea si fasonarea sticlei plate,4.0,612023.0,12086.0,0.06%,2312.0,Prelucrarea si fasonarea sticlei plate,0.0,0.0,0.0,0%,2312.0,Prelucrarea si fasonarea sticlei plate,0.0,0.0,0.0,0%,2312.0,Prelucrarea si fasonarea sticlei plate
DABO BIO TOTAL SRL D,40137270,SIBIU,0762462087,1673043,205887,0.01%,5610,Restaurante,6.0,781207.0,0.0,0.01%,5610.0,Restaurante,12.0,252818.0,71152.0,0%,5610.0,Restaurante,nan,nan,nan,nan,nan,nan
DABO CIBINIUM SRL-D,40137326,SIBIU,-,1452668,0,0.01%,5610,Restaurante,9.0,817596.0,0.0,0.01%,5610.0,Restaurante,7.0,583717.0,203411.0,0%,5610.0,Restaurante,nan,nan,nan,nan,nan,nan
SC GXG AUTO SOFT SRL,40143107,MUREŞ,-,147338,7223,0%,4520,Întretinerea si repararea autovehiculelor,4.0,142430.0,7425.0,0%,4520.0,Întretinerea si repararea autovehiculelor,0.0,0.0,0.0,0%,4520.0,Întretinerea si repararea autovehiculelor,nan,nan,nan,nan,nan,nan
MARBEL CLEAN SRL,40143948,BRAŞOV,-,295163,96869,0.07%,9601,Spalarea si curatarea (uscata) articolelor textile si a produselor din blana,7.0,178677.0,0.0,0.04%,9601.0,Spalarea si curatarea (uscata) articolelor textile si a produselor din blana,3.0,26606.0,0.0,0.01%,9601.0,Spalarea si curatarea (uscata) articolelor textile si a produselor din blana,2.0,18650.0,16168.0,0%,9601.0,Spalarea si curatarea (uscata) articolelor textile si a produselor din blana
S.C TUMAM CLA SRL,40144781,ALBA,0746254315,0,0,0%,4120,Lucrari de constructie a cladirilor rezidentiale si nerezidentiale,2.0,8800.0,108608.0,0%,4120.0,Lucrari de constructie a cladirilor rezidentiale si nerezidentiale,3.0,8032.0,0.0,0%,4120.0,Lucrari de constructie a cladirilor rezidentiale si nerezidentiale,nan,nan,nan,nan,nan,nan
STRUTKI CONSTRUCT SRL,40144773,MUREŞ,-,179368,0,0%,4120,Lucrari de constructie a cladirilor rezidentiale si nerezidentiale,1.0,144181.0,283.0,0%,4120.0,Lucrari de constructie a cladirilor rezidentiale si nerezidentiale,nan,nan,nan,nan,nan,nan,nan,nan,nan,nan,nan,nan
JIVRAJ ANT SRL,40148716,TIMIŞ,-,408630,42590,0%,4120,Lucrari de constructie a cladirilor rezidentiale si nerezidentiale,2.0,70078.0,0.0,0%,4120.0,Lucrari de constructie a cladirilor rezidentiale si nerezidentiale,nan,nan,nan,nan,nan,nan,nan,nan,nan,nan,nan,nan
MOBILA CU SUFLET SRL,40150600,MUREŞ,-,330223,755,0%,3109,Fabricarea de mobila n.c.a.,2.0,221594.0,675.0,0%,3109.0,Fabricarea de mobila n.c.a.,0.0,0.0,0.0,0%,3109.0,Fabricarea de mobila n.c.a.,nan,nan,nan,nan,nan,nan
REGUN MAXINVEST SRL,40150619,MUREŞ,-,270947,45895,0.01%,1520,Fabricarea încaltamintei,6.0,274898.0,47429.0,0.01%,1520.0,Fabricarea încaltamintei,1.0,68635.0,19387.0,0.03%,9609.0,Alte activitati de servicii n.c.a.,nan,nan,nan,nan,nan,nan
KINETICSOFT BY ANDRADA,40150562,MUREŞ,-,289306,93761,0.01%,8690,Alte activitati referitoare la sanatatea umana,4.0,101992.0,0.0,0%,8690.0,Alte activitati referitoare la sanatatea umana,0.0,0.0,0.0,0%,8690.0,Alte activitati referitoare la sanatatea umana,0.0,0.0,0.0,0%,8690.0,Alte activitati referitoare la sanatatea umana
TWINS PIXEL SRL,40151797,SIBIU,0754462428,66800,0,0.02%,7420,Activitati fotografice,5.0,17280.0,0.0,0.01%,7420.0,Activitati fotografice,4.0,0.0,0.0,0%,7420.0,Activitati fotografice,0.0,0.0,0.0,0%,7420.0,Activitati fotografice
SC EXCLUSIVE SELF WASH SRL,40165253,HARGHITA,-,207139,47772,0%,4520,Întretinerea si repararea autovehiculelor,3.0,112487.0,12413.0,0%,4520.0,Întretinerea si repararea autovehiculelor,0.0,0.0,0.0,0%,4520.0,Întretinerea si repararea autovehiculelor,0.0,0.0,0.0,0%,4520.0,Întretinerea si repararea autovehiculelor
S.C. RACOTEX EXECUTION SRL,40166348,MUREŞ,-,1646315,41261,0.03%,2562,Operatiuni de mecanica generala,3.0,1169046.0,17829.0,0.02%,2562.0,Operatiuni de mecanica generala,1.0,63637.0,0.0,0%,2562.0,Operatiuni de mecanica generala,0.0,0.0,0.0,0%,2562.0,Operatiuni de mecanica generala
S.C. PRODENTALUX SRL,40166402,MUREŞ,-,403837,29014,0.01%,8623,Activitati de asistenta stomatologica,7.0,289798.0,0.0,0.01%,8623.0,Activitati de asistenta stomatologica,7.0,51630.0,3800.0,0%,8623.0,Activitati de asistenta stomatologica,0.0,0.0,0.0,0%,8623.0,Activitati de asistenta stomatologica
DRS PROJECTSIB SRL,40167939,SIBIU,0755401501,923320,93381,0.11%,3102,Fabricarea de mobila pentru bucatarii,6.0,856022.0,62297.0,0.11%,3102.0,Fabricarea de mobila pentru bucatarii,1.0,192952.0,45475.0,0.02%,3102.0,Fabricarea de mobila pentru bucatarii,nan,nan,nan,nan,nan,nan
KIMO TEXTILE SRL,40173710,ALBA,-,1999540,26919,0.04%,1413,Fabricarea altor articole de îmbracaminte (exclusiv lenjeria de corp),19.0,451303.0,0.0,0.01%,1413.0,Fabricarea altor articole de îmbracaminte (exclusiv lenjeria de corp),22.0,275339.0,10982.0,0.01%,1413.0,Fabricarea altor articole de îmbracaminte (exclusiv lenjeria de corp),0.0,0.0,0.0,0%,1413.0,Fabricarea altor articole de îmbracaminte (exclusiv lenjeria de corp)
SC LAGANAS ROOMS SRL,40174049,MUREŞ,-,51743,7003,0.01%,5520,Facilitati de cazare pentru vacante si perioade de scurta durata,4.0,66545.0,0.0,0.01%,5520.0,Facilitati de cazare pentru vacante si perioade de scurta durata,0.0,0.0,0.0,0%,5520.0,Facilitati de cazare pentru vacante si perioade de scurta durata,nan,nan,nan,nan,nan,nan
BLUE TERRE,40175508,BRAŞOV,-,6924,0,0%,5520,Facilitati de cazare pentru vacante si perioade de scurta durata,1.0,17070.0,0.0,0%,5520.0,Facilitati de cazare pentru vacante si perioade de scurta durata,0.0,0.0,0.0,0%,5520.0,Facilitati de cazare pentru vacante si perioade de scurta durata,nan,nan,nan,nan,nan,nan
S.C.LAE PECU,40179054,ALBA,-,267141,0,0%,1071,Fabricarea pâinii; fabricarea prajiturilor si a produselor proaspete de patiserie,5.0,214536.0,0.0,0%,1071.0,Fabricarea pâinii; fabricarea prajiturilor si a produselor proaspete de patiserie,0.0,0.0,0.0,0%,1071.0,Fabricarea pâinii; fabricarea prajiturilor si a produselor proaspete de patiserie,nan,nan,nan,nan,nan,nan
VIA GLOW ZONE SRL,40181283,MUREŞ,-,0,0,0%,9602,Coafura si alte activitati de înfrumusetare,3.0,0.0,0.0,0%,9602.0,Coafura si alte activitati de înfrumusetare,nan,nan,nan,nan,nan,nan,nan,nan,nan,nan,nan,nan
OLDENT IIP SRL,40189139,SIBIU,0747077893,146861,4573,0%,8623,Activitati de asistenta stomatologica,0.0,178178.0,3410.0,0.01%,8623.0,Activitati de asistenta stomatologica,5.0,129253.0,16359.0,0%,8623.0,Activitati de asistenta stomatologica,0.0,0.0,0.0,0%,8623.0,Activitati de asistenta stomatologica
TOP FOR TERRA TFT SRL,40196896,BRAŞOV,-,172139,8002,0%,7112,Activitati de inginerie si consultanta tehnica legate de acestea,4.0,60548.0,8839.0,0%,7112.0,Activitati de inginerie si consultanta tehnica legate de acestea,3.0,27554.0,0.0,0%,7112.0,Activitati de inginerie si consultanta tehnica legate de acestea,0.0,0.0,0.0,0%,7112.0,Activitati de inginerie si consultanta tehnica legate de acestea
S.C. KRON MOTOR WORKSHOP S.R.L.,40196950,BRAŞOV,-,1299580,69234,0.01%,4520,Întretinerea si repararea autovehiculelor,6.0,177433.0,0.0,0%,4520.0,Întretinerea si repararea autovehiculelor,0.0,0.0,0.0,0%,4520.0,Întretinerea si repararea autovehiculelor,nan,nan,nan,nan,nan,nan
S.C. DULCES EVENTOS SRL,40202432,MUREŞ,-,23799,0,0%,1071,Fabricarea pâinii; fabricarea prajiturilor si a produselor proaspete de patiserie,3.0,301.0,0.0,0%,1071.0,Fabricarea pâinii; fabricarea prajiturilor si a produselor proaspete de patiserie,nan,nan,nan,nan,nan,nan,nan,nan,nan,nan,nan,nan
TEST GAD AUTO SRL,40207227,ALBA,-,171850,5292,0.04%,8553,Scoli de conducere (pilotaj),1.0,112700.0,19394.0,0.03%,8553.0,Scoli de conducere (pilotaj),2.0,29750.0,0.0,0.01%,8553.0,Scoli de conducere (pilotaj),nan,nan,nan,nan,nan,nan
SC AIR TOP PROIECT SRL,40213539,ALBA,-,295194,57266,0%,7112,Activitati de inginerie si consultanta tehnica legate de acestea,5.0,218486.0,58178.0,0%,7112.0,Activitati de inginerie si consultanta tehnica legate de acestea,3.0,47000.0,0.0,0%,7112.0,Activitati de inginerie si consultanta tehnica legate de acestea,0.0,16000.0,15462.0,0%,7112.0,Activitati de inginerie si consultanta tehnica legate de acestea
TRAVONIX SRL,40217824,BRAŞOV,-,233795,34454,0.01%,1812,Alte activitati de tiparire n.c.a.,4.0,17099.0,0.0,0%,1812.0,Alte activitati de tiparire n.c.a.,0.0,0.0,0.0,0%,1812.0,Alte activitati de tiparire n.c.a.,0.0,0.0,0.0,0%,1812.0,Alte activitati de tiparire n.c.a.
MACESANU CONSTRUCT SRL,40218242,BRAŞOV,0728298717,168000,0,0%,4120,Lucrari de constructie a cladirilor rezidentiale si nerezidentiale,4.0,149246.0,3325.0,0%,4120.0,Lucrari de constructie a cladirilor rezidentiale si nerezidentiale,2.0,120337.0,42765.0,0%,4120.0,Lucrari de constructie a cladirilor rezidentiale si nerezidentiale,1.0,12800.0,11674.0,0%,4120.0,Lucrari de constructie a cladirilor rezidentiale si nerezidentiale
AURARIA STUDIO S.R.L,40218722,ALBA,-,7975,81514,0%,1729,Fabricarea altor articole din hârtie si carton n.c.a.,2.0,0.0,0.0,0%,1729.0,Fabricarea altor articole din hârtie si carton n.c.a.,nan,nan,nan,nan,nan,nan,nan,nan,nan,nan,nan,nan
BANFAM HUNDE IPOSPORT SRL,40220552,HARGHITA,-,17830,0,0.02%,1032,Fabricarea sucurilor de fructe si legume,0.0,35166.0,5145.0,0.05%,1032.0,Fabricarea sucurilor de fructe si legume,0.0,35166.0,5145.0,0.05%,1032.0,Fabricarea sucurilor de fructe si legume,0.0,0.0,0.0,0%,1032.0,Fabricarea sucurilor de fructe si legume
S.C. MARONI EQUIPMENT SRL,40224899,BRAŞOV,-,196003,0,0.01%,1623,"Fabricarea altor elemente de dulgherie si tâmplarie, pentru constructii",5.0,31884.0,0.0,0%,1623.0,"Fabricarea altor elemente de dulgherie si tâmplarie, pentru constructii",0.0,0.0,0.0,0%,1623.0,"Fabricarea altor elemente de dulgherie si tâmplarie, pentru constructii",0.0,0.0,0.0,0%,7732.0,Activitati de închiriere si leasing de masini si echipamente pentru constructii
GIOVI MATILUC SRL,40233595,BRAŞOV,0736925957,178225,0,0.02%,5621,Activitati de alimentatie (catering) pentru evenimente,5.0,57884.0,0.0,0.01%,5621.0,Activitati de alimentatie (catering) pentru evenimente,0.0,0.0,0.0,0%,5621.0,Activitati de alimentatie (catering) pentru evenimente,nan,nan,nan,nan,nan,nan
HART EVENT PROD SRL,40233528,BRAŞOV,0771618548,10000,0,0%,8230,"Activitati de organizare a expozitiilor, târgurilor si congreselor",0.0,3500.0,0.0,0%,8230.0,"Activitati de organizare a expozitiilor, târgurilor si congreselor",nan,nan,nan,nan,nan,nan,nan,nan,nan,nan,nan,nan
S.C. PELETI CASOLT SRL,40233820,SIBIU,-,0,0,0%,1629,"Fabricarea altor produse din lemn; fabricarea articolelor din pluta, paie si din alte materiale vegetale împletite",0.0,0.0,0.0,0%,1629.0,"Fabricarea altor produse din lemn; fabricarea articolelor din pluta, paie si din alte materiale vegetale împletite",0.0,0.0,0.0,0%,1629.0,"Fabricarea altor produse din lemn; fabricarea articolelor din pluta, paie si din alte materiale vegetale împletite",0.0,0.0,0.0,0%,1629.0,"Fabricarea altor produse din lemn; fabricarea articolelor din pluta, paie si din alte materiale vegetale împletite"
JECA MARAEV SRL,40237023,ALBA,-,1150,0,0%,5224,Manipulari,3.0,4034.0,0.0,0%,5224.0,Manipulari,0.0,5882.0,799.0,0%,5224.0,Manipulari,0.0,2500.0,1292.0,0%,5224.0,Manipulari
MAVOFAM MOBILA S.R.L.,40238614,HARGHITA,0757386285,30850,25037,0%,3101,Fabricarea de mobila pentru birouri si magazine,3.0,56250.0,1054.0,0%,3101.0,Fabricarea de mobila pentru birouri si magazine,1.0,0.0,0.0,0%,3101.0,Fabricarea de mobila pentru birouri si magazine,nan,nan,nan,nan,nan,nan
SC DISPENZA POWER SRL,40239415,MUREŞ,0725224138,524182,62794,0.01%,4520,Întretinerea si repararea autovehiculelor,4.0,338289.0,0.0,0%,4520.0,Întretinerea si repararea autovehiculelor,1.0,67499.0,0.0,0%,4520.0,Întretinerea si repararea autovehiculelor,1.0,0.0,0.0,0%,4520.0,Întretinerea si repararea autovehiculelor
S.C.SILVERTOPGOLD ROOM SRL,40257284,HARGHITA,0747874157,2215912,133280,0.01%,4721,"Comert cu amanuntul al fructelor si legumelor proaspete, în magazine specializate",5.0,959939.0,13341.0,0.07%,1039.0,Prelucrarea si conservarea fructelor si legumelor n.c.a.,nan,nan,nan,nan,nan,nan,nan,nan,nan,nan,nan,nan
PAULIONIS STAR SRL,40260581,MUREŞ,-,62986,0,0%,4520,Întretinerea si repararea autovehiculelor,6.0,67226.0,0.0,0%,4520.0,Întretinerea si repararea autovehiculelor,1.0,74879.0,0.0,0%,4520.0,Întretinerea si repararea autovehiculelor,nan,nan,nan,nan,nan,nan
PIETRICICA ALBA SRL,40260638,MUREŞ,-,119580,0,0.01%,812,Extractia pietrisului si nisipului; extractia argilei si caolinului,4.0,95530.0,1227.0,0.01%,812.0,Extractia pietrisului si nisipului; extractia argilei si caolinului,1.0,31500.0,28382.0,0%,812.0,Extractia pietrisului si nisipului; extractia argilei si caolinului,nan,nan,nan,nan,nan,nan
SC STELA CLEAN SERVICE SRL,40260603,MUREŞ,-,192818,31914,0.01%,8121,Activitati generale (nespecializate) de curatenie interioara a cladirilor,4.0,125782.0,0.0,0.01%,8121.0,Activitati generale (nespecializate) de curatenie interioara a cladirilor,3.0,0.0,0.0,0%,8121.0,Activitati generale (nespecializate) de curatenie interioara a cladirilor,nan,nan,nan,nan,nan,nan
EDUARD TOTAL SERVICE S.R.L.,40268615,SIBIU,-,15716,0,0%,8130,Activitati de întretinere peisagistica,3.0,28450.0,0.0,0%,8130.0,Activitati de întretinere peisagistica,0.0,10995.0,1794.0,0%,8130.0,Activitati de întretinere peisagistica,nan,nan,nan,nan,nan,nan
AUTO REIFEN TEF SRL,40268631,SIBIU,-,1045223,102802,0.01%,4520,Întretinerea si repararea autovehiculelor,2.0,622726.0,12161.0,0.01%,4520.0,Întretinerea si repararea autovehiculelor,2.0,483365.0,11515.0,0.01%,4520.0,Întretinerea si repararea autovehiculelor,nan,nan,nan,nan,nan,nan
