Nume,CodFiscal,Judet,Telefon,CifraDeAfaceriNetaRON2021,ProfitNetRON2021,CotaDePiata2021,CodCAEN2021,DescriereCodCAEN2021,Salariati2020,CifraDeAfaceriNetaRON2020,ProfitNetRON2020,CotaDePiata2020,CodCAEN2020,DescriereCodCAEN2020,Salariati2019,CifraDeAfaceriNetaRON2019,ProfitNetRON2019,CotaDePiata2019,CodCAEN2019,DescriereCodCAEN2019,Salariati2018,CifraDeAfaceriNetaRON2018,ProfitNetRON2018,CotaDePiata2018,CodCAEN2018,DescriereCodCAEN2018
S.C.SAVORYA CRISTIAN SRL,40387632,BRAŞOV,-,687950,0,0.07%,5621,Activitati de alimentatie (catering) pentru evenimente,3.0,393823.0,71592.0,0.04%,5621.0,Activitati de alimentatie (catering) pentru evenimente,0.0,0.0,0.0,0%,5621.0,Activitati de alimentatie (catering) pentru evenimente,nan,nan,nan,nan,nan,nan
FORTUNA EDIDENT HELP SRL,40389773,HARGHITA,-,184558,19395,0.01%,8623,Activitati de asistenta stomatologica,4.0,286061.0,163075.0,0.01%,8623.0,Activitati de asistenta stomatologica,4.0,40116.0,0.0,0%,8623.0,Activitati de asistenta stomatologica,nan,nan,nan,nan,nan,nan
S.C. UTIL CROP SRL,40390964,ALBA,-,27200,0,0%,4312,Lucrari de pregatire a terenului,3.0,21107.0,0.0,0%,4312.0,Lucrari de pregatire a terenului,0.0,0.0,0.0,0%,4312.0,Lucrari de pregatire a terenului,nan,nan,nan,nan,nan,nan
TERMOCLASS TABACARI S.R.L.,40391048,BRAŞOV,0769370429,237455,1547,0%,2223,Fabricarea articolelor din material plastic pentru constructii,2.0,93808.0,878.0,0%,2223.0,Fabricarea articolelor din material plastic pentru constructii,3.0,4615.0,0.0,0%,2223.0,Fabricarea articolelor din material plastic pentru constructii,nan,nan,nan,nan,nan,nan
S.C.MAG-MECHANICAL ASSEMBLY GROUP SRL,40391030,BRAŞOV,-,182339,122306,0%,4120,Lucrari de constructie a cladirilor rezidentiale si nerezidentiale,3.0,257129.0,3457.0,0%,4120.0,Lucrari de constructie a cladirilor rezidentiale si nerezidentiale,4.0,222444.0,14850.0,0%,4120.0,Lucrari de constructie a cladirilor rezidentiale si nerezidentiale,nan,nan,nan,nan,nan,nan
APP WRITERS SRL-D,40392060,ALBA,-,0,0,0%,6201,Activitati de realizare a software-ului la comanda (software orientat client),4.0,0.0,0.0,0%,6201.0,Activitati de realizare a software-ului la comanda (software orientat client),0.0,0.0,0.0,0%,6201.0,Activitati de realizare a software-ului la comanda (software orientat client),nan,nan,nan,nan,nan,nan
ANG BAU HAUS PRO SRL,40395074,MUREŞ,-,353040,0,0.02%,4312,Lucrari de pregatire a terenului,5.0,24730.0,0.0,0%,4312.0,Lucrari de pregatire a terenului,2.0,11652.0,0.0,0%,4312.0,Lucrari de pregatire a terenului,nan,nan,nan,nan,nan,nan
CLASSTEM  NEGOIU S.R.L.,40395180,BRAŞOV,0757011397,354600,32900,0%,3109,Fabricarea de mobila n.c.a.,3.0,208495.0,14406.0,0%,3109.0,Fabricarea de mobila n.c.a.,1.0,0.0,0.0,0%,3109.0,Fabricarea de mobila n.c.a.,nan,nan,nan,nan,nan,nan
S.C. IXS ROLL SRL,40395252,BRAŞOV,-,21165,0,0%,1729,Fabricarea altor articole din hârtie si carton n.c.a.,4.0,69041.0,0.0,0.01%,1729.0,Fabricarea altor articole din hârtie si carton n.c.a.,1.0,215175.0,139020.0,0.04%,1729.0,Fabricarea altor articole din hârtie si carton n.c.a.,nan,nan,nan,nan,nan,nan
CITY EXPERT CLEANING SRL,40396096,SIBIU,-,75021,0,0.02%,9601,Spalarea si curatarea (uscata) articolelor textile si a produselor din blana,3.0,2422.0,0.0,0%,9601.0,Spalarea si curatarea (uscata) articolelor textile si a produselor din blana,nan,nan,nan,nan,nan,nan,nan,nan,nan,nan,nan,nan
SC CYGUARDIAN IDM S.R.L.,40399823,ALBA,-,282465,2882,0.01%,6920,Activitati de contabilitate si audit financiar; consultanta în domeniul fiscal,7.0,212600.0,13105.0,0.01%,6920.0,Activitati de contabilitate si audit financiar; consultanta în domeniul fiscal,3.0,172745.0,55513.0,0%,6920.0,Activitati de contabilitate si audit financiar; consultanta în domeniul fiscal,nan,nan,nan,nan,nan,nan
S.C. FITNESS GLOBAL TEAM SRL,40405364,SIBIU,0752097451,0,0,0%,9313,Activitati ale centrelor de fitness,1.0,0.0,0.0,0%,9313.0,Activitati ale centrelor de fitness,nan,nan,nan,nan,nan,nan,nan,nan,nan,nan,nan,nan
S.C. GLOBAL PLAYGROUND SRL,40405330,SIBIU,0754534610,0,0,0%,9313,Activitati ale centrelor de fitness,1.0,0.0,0.0,0%,9313.0,Activitati ale centrelor de fitness,nan,nan,nan,nan,nan,nan,nan,nan,nan,nan,nan,nan
NORART EXPERT CONSTRUCT SRL,40407748,ALBA,-,1348795,2799,0%,4120,Lucrari de constructie a cladirilor rezidentiale si nerezidentiale,7.0,500304.0,46192.0,0%,4120.0,Lucrari de constructie a cladirilor rezidentiale si nerezidentiale,1.0,123868.0,17707.0,0%,4120.0,Lucrari de constructie a cladirilor rezidentiale si nerezidentiale,nan,nan,nan,nan,nan,nan
S.C.KINGTERM EXPERT SRL,40409250,ALBA,-,56860,0,0%,4399,Alte lucrari speciale de constructii n.c.a.,4.0,0.0,0.0,0%,4399.0,Alte lucrari speciale de constructii n.c.a.,nan,nan,nan,nan,nan,nan,nan,nan,nan,nan,nan,nan
4K EDIT SRL,40409277,ALBA,-,0,0,0%,5912,"Activitati de post-productie cinematografica, video si de programe de televiziune",3.0,11000.0,0.0,0.01%,5912.0,"Activitati de post-productie cinematografica, video si de programe de televiziune",4.0,0.0,0.0,0%,5912.0,"Activitati de post-productie cinematografica, video si de programe de televiziune",nan,nan,nan,nan,nan,nan
S.C. KADENO SOLUTIONS SRL,40411455,MUREŞ,-,475575,141028,0%,6201,Activitati de realizare a software-ului la comanda (software orientat client),4.0,342851.0,113919.0,0%,6201.0,Activitati de realizare a software-ului la comanda (software orientat client),4.0,71884.0,29725.0,0%,6201.0,Activitati de realizare a software-ului la comanda (software orientat client),nan,nan,nan,nan,nan,nan
STEAM CLOTHING LINE,40411358,MUREŞ,-,114826,0,0%,1413,Fabricarea altor articole de îmbracaminte (exclusiv lenjeria de corp),6.0,165177.0,0.0,0%,1413.0,Fabricarea altor articole de îmbracaminte (exclusiv lenjeria de corp),0.0,0.0,0.0,0%,1413.0,Fabricarea altor articole de îmbracaminte (exclusiv lenjeria de corp),nan,nan,nan,nan,nan,nan
DACHDECKER NICU S.R.L.,40411463,MUREŞ,-,85925,25986,0.01%,2599,Fabricarea altor articole din metal n.c.a.,5.0,51650.0,0.0,0%,2599.0,Fabricarea altor articole din metal n.c.a.,2.0,21350.0,609.0,0%,2599.0,Fabricarea altor articole din metal n.c.a.,nan,nan,nan,nan,nan,nan
HESTIA NETWORK SRL,40413170,BRAŞOV,-,35635,0,0.01%,8020,Activitati de servicii privind sistemele de securizare,5.0,15418.0,0.0,0%,8020.0,Activitati de servicii privind sistemele de securizare,3.0,59596.0,0.0,0.01%,8020.0,Activitati de servicii privind sistemele de securizare,nan,nan,nan,nan,nan,nan
S.C.BIJUTERII LASER SRL,40413286,BRAŞOV,0762462646,1731308,846866,0.79%,3212,Fabricarea bijuteriilor si articolelor similare din metale si pietre pretioase,4.0,0.0,0.0,0%,3212.0,Fabricarea bijuteriilor si articolelor similare din metale si pietre pretioase,1.0,0.0,0.0,0%,3212.0,Fabricarea bijuteriilor si articolelor similare din metale si pietre pretioase,nan,nan,nan,nan,nan,nan
S.C. PITUTE PAN SRL,40413650,SIBIU,-,457750,17930,0.01%,1071,Fabricarea pâinii; fabricarea prajiturilor si a produselor proaspete de patiserie,6.0,411628.0,3191.0,0%,1071.0,Fabricarea pâinii; fabricarea prajiturilor si a produselor proaspete de patiserie,6.0,193675.0,41378.0,0%,1071.0,Fabricarea pâinii; fabricarea prajiturilor si a produselor proaspete de patiserie,nan,nan,nan,nan,nan,nan
BEST INSTAL PROFI SRL,40417474,ALBA,-,64907,0,0%,4120,Lucrari de constructie a cladirilor rezidentiale si nerezidentiale,4.0,44889.0,0.0,0%,4120.0,Lucrari de constructie a cladirilor rezidentiale si nerezidentiale,0.0,0.0,0.0,0%,4120.0,Lucrari de constructie a cladirilor rezidentiale si nerezidentiale,nan,nan,nan,nan,nan,nan
VLADAN FOREST S.R.L.,40417571,BRAŞOV,-,0,0,0%,1610,Taierea si rindeluirea lemnului,5.0,0.0,0.0,0%,1610.0,Taierea si rindeluirea lemnului,2.0,0.0,0.0,0%,1610.0,Taierea si rindeluirea lemnului,nan,nan,nan,nan,nan,nan
SC ROVALCO SERV SRL,40417520,BRAŞOV,0748161230,289377,17643,0%,4520,Întretinerea si repararea autovehiculelor,0.0,114355.0,18540.0,0%,4520.0,Întretinerea si repararea autovehiculelor,0.0,28756.0,0.0,0%,4791.0,Comert cu amanuntul prin intermediul caselor de comenzi sau prin Internet,nan,nan,nan,nan,nan,nan
SC  HERHAB YARD SRL,40420038,MUREŞ,-,707865,34607,0%,5610,Restaurante,8.0,999683.0,238546.0,0.01%,5610.0,Restaurante,8.0,597549.0,137602.0,0%,5610.0,Restaurante,nan,nan,nan,nan,nan,nan
SOCIETATEA G-SWEEPERS SRL,40419963,MUREŞ,-,5136,185,0%,9601,Spalarea si curatarea (uscata) articolelor textile si a produselor din blana,0.0,0.0,0.0,0%,9601.0,Spalarea si curatarea (uscata) articolelor textile si a produselor din blana,0.0,0.0,0.0,0%,9601.0,Spalarea si curatarea (uscata) articolelor textile si a produselor din blana,nan,nan,nan,nan,nan,nan
CARWOOD HSV SRL,40420127,MUREŞ,-,304835,1732,0.02%,1623,"Fabricarea altor elemente de dulgherie si tâmplarie, pentru constructii",8.0,202656.0,0.0,0.01%,1623.0,"Fabricarea altor elemente de dulgherie si tâmplarie, pentru constructii",2.0,107381.0,47802.0,0.01%,1623.0,"Fabricarea altor elemente de dulgherie si tâmplarie, pentru constructii",nan,nan,nan,nan,nan,nan
S.C.SIA SRL TARNAVENI,40420046,MUREŞ,-,0,0,0%,9329,Alte activitati recreative si distractive n.c.a.,1.0,0.0,0.0,0%,9329.0,Alte activitati recreative si distractive n.c.a.,0.0,0.0,0.0,0%,9329.0,Alte activitati recreative si distractive n.c.a.,nan,nan,nan,nan,nan,nan
SC LS RENT SERV SRL,40420151,MUREŞ,-,300000,49431,0%,5229,Alte activitati anexe transporturilor,4.0,210000.0,44383.0,0%,5229.0,Alte activitati anexe transporturilor,0.0,10000.0,2669.0,0%,5229.0,Alte activitati anexe transporturilor,nan,nan,nan,nan,nan,nan
ASTARTE LOTUS SRL,40420763,BRAŞOV,0746535486,195214,0,0.06%,9604,Activitati de întretinere corporala,5.0,125270.0,0.0,0.04%,9604.0,Activitati de întretinere corporala,3.0,7541.0,0.0,0%,9604.0,Activitati de întretinere corporala,nan,nan,nan,nan,nan,nan
CATERING SANATOS S.R.L.,40421963,SIBIU,-,402064,0,0.04%,5621,Activitati de alimentatie (catering) pentru evenimente,5.0,248684.0,0.0,0.03%,5621.0,Activitati de alimentatie (catering) pentru evenimente,4.0,0.0,0.0,0%,5621.0,Activitati de alimentatie (catering) pentru evenimente,nan,nan,nan,nan,nan,nan
SC KETTLEBELL GYM SRL,40426235,HARGHITA,0744118943,176143,22868,0.04%,9313,Activitati ale centrelor de fitness,4.0,47801.0,0.0,0.01%,9313.0,Activitati ale centrelor de fitness,1.0,0.0,0.0,0%,9313.0,Activitati ale centrelor de fitness,nan,nan,nan,nan,nan,nan
SC AUTOVALEX SERVICE SRL,40426707,ALBA,-,0,0,0%,7120,Activitati de testare si analize tehnice,1.0,0.0,0.0,0%,7120.0,Activitati de testare si analize tehnice,0.0,0.0,0.0,0%,7120.0,Activitati de testare si analize tehnice,nan,nan,nan,nan,nan,nan
TRIATIC BAU SRL,40430678,BRAŞOV,-,38711971,0,0.07%,4120,Lucrari de constructie a cladirilor rezidentiale si nerezidentiale,116.0,19347990.0,217335.0,0.03%,4120.0,Lucrari de constructie a cladirilor rezidentiale si nerezidentiale,71.0,5365303.0,159721.0,0.01%,4120.0,Lucrari de constructie a cladirilor rezidentiale si nerezidentiale,nan,nan,nan,nan,nan,nan
MAISON COCO TEXTIL SRL,40431436,SIBIU,-,84000,0,0%,1392,Fabricarea de articole confectionate din textile (cu exceptia îmbracamintei si lenjeriei de corp),4.0,5795.0,0.0,0%,1392.0,Fabricarea de articole confectionate din textile (cu exceptia îmbracamintei si lenjeriei de corp),0.0,0.0,0.0,0%,1392.0,Fabricarea de articole confectionate din textile (cu exceptia îmbracamintei si lenjeriei de corp),nan,nan,nan,nan,nan,nan
OPRITA BUSINESS ALBA SRL,40434009,ALBA,-,973779,263011,0.04%,1072,Fabricarea biscuitilor si piscoturilor; fabricarea prajiturilor si a produselor conservate de patiserie,8.0,837692.0,208405.0,0.04%,1072.0,Fabricarea biscuitilor si piscoturilor; fabricarea prajiturilor si a produselor conservate de patiserie,4.0,488528.0,172815.0,0.01%,1071.0,Fabricarea pâinii; fabricarea prajiturilor si a produselor proaspete de patiserie,nan,nan,nan,nan,nan,nan
OPRITA BUSINESS SEBES SRL,40434025,ALBA,-,2096524,701795,0.1%,1072,Fabricarea biscuitilor si piscoturilor; fabricarea prajiturilor si a produselor conservate de patiserie,11.0,1262776.0,345599.0,0.06%,1072.0,Fabricarea biscuitilor si piscoturilor; fabricarea prajiturilor si a produselor conservate de patiserie,5.0,582999.0,149027.0,0.01%,1071.0,Fabricarea pâinii; fabricarea prajiturilor si a produselor proaspete de patiserie,nan,nan,nan,nan,nan,nan
TRANSILVANIA SAB PRODUCT S.R.L.,40433976,ALBA,-,1408905,75115,0.19%,3299,Fabricarea altor produse manufacturiere n.c.a.,11.0,878610.0,49321.0,0.12%,3299.0,Fabricarea altor produse manufacturiere n.c.a.,3.0,101230.0,0.0,0.01%,3299.0,Fabricarea altor produse manufacturiere n.c.a.,nan,nan,nan,nan,nan,nan
BEAUTY PAPER S.R.L.,40433992,ALBA,-,0,0,0%,1722,"Fabricarea produselor de uz gospodaresc si sanitar, din hârtie sau carton",4.0,0.0,0.0,0%,1722.0,"Fabricarea produselor de uz gospodaresc si sanitar, din hârtie sau carton",0.0,0.0,0.0,0%,1722.0,"Fabricarea produselor de uz gospodaresc si sanitar, din hârtie sau carton",nan,nan,nan,nan,nan,nan
OASIS FOR SOLUTIONS SRL-D,40434939,ALBA,-,0,0,0%,6201,Activitati de realizare a software-ului la comanda (software orientat client),3.0,0.0,0.0,0%,6201.0,Activitati de realizare a software-ului la comanda (software orientat client),0.0,0.0,0.0,0%,6201.0,Activitati de realizare a software-ului la comanda (software orientat client),nan,nan,nan,nan,nan,nan
TERALEX MONTAJ SRL,40437544,ALBA,-,148795,0,0.01%,4332,Lucrari de tâmplarie si dulgherie,1.0,9100.0,0.0,0%,4332.0,Lucrari de tâmplarie si dulgherie,0.0,0.0,0.0,0%,4332.0,Lucrari de tâmplarie si dulgherie,nan,nan,nan,nan,nan,nan
SC ERP SOFTCONS SRL,40438086,BRAŞOV,0741154878,55770,0,0%,6202,Activitati de consultanta în tehnologia informatiei,6.0,41638.0,0.0,0%,6202.0,Activitati de consultanta în tehnologia informatiei,0.0,0.0,0.0,0%,6202.0,Activitati de consultanta în tehnologia informatiei,nan,nan,nan,nan,nan,nan
CAROL BABY DESIGN,40438663,MUREŞ,-,160943,0,0%,1413,Fabricarea altor articole de îmbracaminte (exclusiv lenjeria de corp),7.0,89370.0,0.0,0%,1413.0,Fabricarea altor articole de îmbracaminte (exclusiv lenjeria de corp),nan,nan,nan,nan,nan,nan,nan,nan,nan,nan,nan,nan
PRO-COR DENTAL SRL,40440477,SIBIU,0766667144,621804,127078,0.02%,8623,Activitati de asistenta stomatologica,5.0,29963.0,0.0,0%,8623.0,Activitati de asistenta stomatologica,0.0,2000.0,1002.0,0%,8623.0,Activitati de asistenta stomatologica,nan,nan,nan,nan,nan,nan
AGRO BBG PRODUCTIE GRUP SRL,40442044,COVASNA,-,139815,0,0.01%,1039,Prelucrarea si conservarea fructelor si legumelor n.c.a.,4.0,32433.0,4676.0,0%,1039.0,Prelucrarea si conservarea fructelor si legumelor n.c.a.,1.0,8464.0,38446.0,0%,1039.0,Prelucrarea si conservarea fructelor si legumelor n.c.a.,nan,nan,nan,nan,nan,nan
PAN CHE START SRL,40447289,MUREŞ,-,39591,0,0%,1071,Fabricarea pâinii; fabricarea prajiturilor si a produselor proaspete de patiserie,4.0,1979.0,0.0,0%,1071.0,Fabricarea pâinii; fabricarea prajiturilor si a produselor proaspete de patiserie,0.0,3403.0,0.0,0%,1071.0,Fabricarea pâinii; fabricarea prajiturilor si a produselor proaspete de patiserie,nan,nan,nan,nan,nan,nan
DRAGODEA SERV,40447343,MUREŞ,-,166785,25544,0%,4520,Întretinerea si repararea autovehiculelor,6.0,82182.0,28905.0,0%,4520.0,Întretinerea si repararea autovehiculelor,2.0,12653.0,0.0,0%,4520.0,Întretinerea si repararea autovehiculelor,nan,nan,nan,nan,nan,nan
BLAGAGOR EDIL SRL,40447211,MUREŞ,-,294312,1975,0.01%,4221,Lucrari de constructie a proiectelor utilitare pentru fluide,5.0,329883.0,3241.0,0.01%,4221.0,Lucrari de constructie a proiectelor utilitare pentru fluide,1.0,175452.0,38168.0,0%,4221.0,Lucrari de constructie a proiectelor utilitare pentru fluide,nan,nan,nan,nan,nan,nan
DEMETER CATERING,40447238,MUREŞ,-,0,0,0%,5621,Activitati de alimentatie (catering) pentru evenimente,4.0,165971.0,10207.0,0.02%,5621.0,Activitati de alimentatie (catering) pentru evenimente,1.0,0.0,0.0,0%,5621.0,Activitati de alimentatie (catering) pentru evenimente,nan,nan,nan,nan,nan,nan
SC VPT IMPEX SRL,40449859,BRAŞOV,-,289510,7372,0.26%,9319,Alte activitati sportive,4.0,296823.0,40279.0,0.27%,9319.0,Alte activitati sportive,3.0,108723.0,0.0,0.1%,9319.0,Alte activitati sportive,nan,nan,nan,nan,nan,nan
BEBE COOL SRL,40450179,SIBIU,0726222230,0,0,0%,5610,Restaurante,0.0,0.0,0.0,0%,5610.0,Restaurante,0.0,0.0,0.0,0%,5610.0,Restaurante,nan,nan,nan,nan,nan,nan
S.C. COPET AGROINVEST SRL,40454014,HARGHITA,-,939431,78758,0.01%,1610,Taierea si rindeluirea lemnului,4.0,186690.0,34100.0,0%,1610.0,Taierea si rindeluirea lemnului,2.0,48592.0,5237.0,0%,1610.0,Taierea si rindeluirea lemnului,nan,nan,nan,nan,nan,nan
S.C. VLAD SERVIS CARPATI SRL,40454030,HARGHITA,-,360603,43302,0%,4520,Întretinerea si repararea autovehiculelor,5.0,112330.0,0.0,0%,4520.0,Întretinerea si repararea autovehiculelor,0.0,0.0,0.0,0%,4520.0,Întretinerea si repararea autovehiculelor,nan,nan,nan,nan,nan,nan
S.C. HYDROTARE 2019 SRL,40454332,ALBA,-,0,0,0%,9329,Alte activitati recreative si distractive n.c.a.,3.0,0.0,0.0,0%,9329.0,Alte activitati recreative si distractive n.c.a.,0.0,0.0,0.0,0%,9329.0,Alte activitati recreative si distractive n.c.a.,nan,nan,nan,nan,nan,nan
S.C. FITRA ARHITECTURA SRL,40454340,ALBA,-,299169,0,0.01%,7111,Activitati de arhitectura,3.0,154275.0,0.0,0.01%,7111.0,Activitati de arhitectura,1.0,58946.0,41165.0,0%,7111.0,Activitati de arhitectura,nan,nan,nan,nan,nan,nan
THELESERV ELECTRONICS S.R.L.,40455788,BRAŞOV,0728858708,257351,62565,0.13%,9521,"Repararea aparatelor electronice, de uz casnic",4.0,59064.0,61291.0,0.03%,9521.0,"Repararea aparatelor electronice, de uz casnic",nan,nan,nan,nan,nan,nan,nan,nan,nan,nan,nan,nan
QUICK SNAP SRL,40456147,HUNEDOARA,-,1200,0,0%,7420,Activitati fotografice,0.0,0.0,0.0,0%,7420.0,Activitati fotografice,0.0,0.0,0.0,0%,7420.0,Activitati fotografice,nan,nan,nan,nan,nan,nan
WONDERSUN STAR SRL,40456333,ALBA,-,207803,47962,0.07%,9604,Activitati de întretinere corporala,2.0,0.0,0.0,0%,9604.0,Activitati de întretinere corporala,0.0,0.0,0.0,0%,9604.0,Activitati de întretinere corporala,nan,nan,nan,nan,nan,nan
AGREGATE BAIA S.R.L.,40456309,ALBA,-,46860,130779,0%,811,"Extractia pietrei ornamentale si a pietrei pentru constructii, extractia pietrei calcaroase, ghipsului, cretei si a ardeziei",5.0,42000.0,0.0,0%,811.0,"Extractia pietrei ornamentale si a pietrei pentru constructii, extractia pietrei calcaroase, ghipsului, cretei si a ardeziei",1.0,66100.0,54136.0,0.01%,811.0,"Extractia pietrei ornamentale si a pietrei pentru constructii, extractia pietrei calcaroase, ghipsului, cretei si a ardeziei",nan,nan,nan,nan,nan,nan
SMART SOCIAL COMMUNICATIONS STAR S.R.L.,40457940,BRAŞOV,-,423294,52596,0%,7311,Activitati ale agentiilor de publicitate,4.0,86518.0,0.0,0%,7311.0,Activitati ale agentiilor de publicitate,4.0,48240.0,23826.0,0%,7311.0,Activitati ale agentiilor de publicitate,nan,nan,nan,nan,nan,nan
UNITED 1878 SRL,40459380,SIBIU,-,111466,0,0%,5610,Restaurante,5.0,68000.0,0.0,0%,5610.0,Restaurante,nan,nan,nan,nan,nan,nan,nan,nan,nan,nan,nan,nan
LC9M PRODUCTION SRL,40459470,SIBIU,-,1706704,107108,0.49%,1396,Fabricarea de articole tehnice si industriale din textile,15.0,1795231.0,117901.0,0.51%,1396.0,Fabricarea de articole tehnice si industriale din textile,14.0,682373.0,0.0,0.2%,1396.0,Fabricarea de articole tehnice si industriale din textile,nan,nan,nan,nan,nan,nan
FLOWTEX-MED SRL,40459615,SIBIU,-,413462,0,0.16%,4313,Lucrari de foraj si sondaj pentru constructii,3.0,237656.0,0.0,0.09%,4313.0,Lucrari de foraj si sondaj pentru constructii,1.0,600.0,0.0,0%,4313.0,Lucrari de foraj si sondaj pentru constructii,nan,nan,nan,nan,nan,nan
CINECT TRANSILVANIA SRL,40462661,ALBA,-,55000,0,0.07%,5912,"Activitati de post-productie cinematografica, video si de programe de televiziune",4.0,36372.0,0.0,0.05%,5912.0,"Activitati de post-productie cinematografica, video si de programe de televiziune",0.0,58262.0,9950.0,0.07%,5912.0,"Activitati de post-productie cinematografica, video si de programe de televiziune",nan,nan,nan,nan,nan,nan
TRAILER WEBSITE BUILD SRL,40464107,ALBA,-,30000,0,0%,6201,Activitati de realizare a software-ului la comanda (software orientat client),4.0,25697.0,0.0,0%,6201.0,Activitati de realizare a software-ului la comanda (software orientat client),3.0,0.0,0.0,0%,6201.0,Activitati de realizare a software-ului la comanda (software orientat client),nan,nan,nan,nan,nan,nan
PREFABRICATE BAIA S.R.L.,40464930,ALBA,-,20814,37694,0%,2361,Fabricarea produselor din beton pentru constructii,1.0,61000.0,3793.0,0%,2361.0,Fabricarea produselor din beton pentru constructii,nan,nan,nan,nan,nan,nan,nan,nan,nan,nan,nan,nan
AROCAMENTE ROSIA S.R.L.,40464948,ALBA,-,54705,78040,0%,811,"Extractia pietrei ornamentale si a pietrei pentru constructii, extractia pietrei calcaroase, ghipsului, cretei si a ardeziei",4.0,173000.0,16726.0,0.01%,811.0,"Extractia pietrei ornamentale si a pietrei pentru constructii, extractia pietrei calcaroase, ghipsului, cretei si a ardeziei",nan,nan,nan,nan,nan,nan,nan,nan,nan,nan,nan,nan
MOB  TATTOO STUDIO SRL,40466884,MUREŞ,-,0,0,0%,9609,Alte activitati de servicii n.c.a.,1.0,0.0,0.0,0%,9609.0,Alte activitati de servicii n.c.a.,2.0,0.0,0.0,0%,9609.0,Alte activitati de servicii n.c.a.,nan,nan,nan,nan,nan,nan
SC JUNIOR BAKERY SRL,40466868,MUREŞ,-,154748,12351,0%,5610,Restaurante,8.0,0.0,0.0,0%,5610.0,Restaurante,1.0,96059.0,17521.0,0%,5610.0,Restaurante,nan,nan,nan,nan,nan,nan
SARYSA CONS SRL,40468036,SIBIU,0744211852,0,0,0%,4120,Lucrari de constructie a cladirilor rezidentiale si nerezidentiale,5.0,10587.0,0.0,0%,4120.0,Lucrari de constructie a cladirilor rezidentiale si nerezidentiale,5.0,0.0,0.0,0%,4120.0,Lucrari de constructie a cladirilor rezidentiale si nerezidentiale,nan,nan,nan,nan,nan,nan
ERW SIB FOOD SRL,40468125,BRAŞOV,0749010515,330753,42431,0.16%,1085,Fabricarea de mâncaruri preparate,8.0,299905.0,89774.0,0.15%,1085.0,Fabricarea de mâncaruri preparate,13.0,82385.0,6297.0,0.04%,1085.0,Fabricarea de mâncaruri preparate,nan,nan,nan,nan,nan,nan
S.C.CAKETIME KRONSTADT S.R.L.,40468362,BIHOR,-,158122,0,0%,5610,Restaurante,3.0,0.0,0.0,0%,5610.0,Restaurante,nan,nan,nan,nan,nan,nan,nan,nan,nan,nan,nan,nan
TRAUM MASAJ S.R.L.,40468389,BRAŞOV,-,0,0,0%,9604,Activitati de întretinere corporala,0.0,0.0,0.0,0%,9604.0,Activitati de întretinere corporala,0.0,0.0,0.0,0%,9604.0,Activitati de întretinere corporala,nan,nan,nan,nan,nan,nan
SC PARA PLEION SRL,40470761,ALBA,-,77439,51112,0%,2223,Fabricarea articolelor din material plastic pentru constructii,0.0,37386.0,23894.0,0%,2223.0,Fabricarea articolelor din material plastic pentru constructii,0.0,3345.0,1687.0,0%,2223.0,Fabricarea articolelor din material plastic pentru constructii,nan,nan,nan,nan,nan,nan
SC MULTIPROD CONSULTING OMMA SRL,40473679,ALBA,-,299900,125988,0%,7022,Activitati de consultanta pentru afaceri si management,5.0,285000.0,78488.0,0%,7022.0,Activitati de consultanta pentru afaceri si management,3.0,85000.0,68850.0,0%,7022.0,Activitati de consultanta pentru afaceri si management,nan,nan,nan,nan,nan,nan
METAL SERIES FORM SRL,40474178,ALBA,-,597320,133094,0.01%,2511,Fabricarea de constructii metalice si parti componente ale structurilor metalice,5.0,365752.0,143967.0,0%,2511.0,Fabricarea de constructii metalice si parti componente ale structurilor metalice,0.0,0.0,0.0,0%,2511.0,Fabricarea de constructii metalice si parti componente ale structurilor metalice,nan,nan,nan,nan,nan,nan
S.C. TIAMED OPTICRISTAL SRL,40476934,MUREŞ,-,167200,42386,0%,8622,Activitati de asistenta medicala specializata,3.0,64000.0,0.0,0%,8622.0,Activitati de asistenta medicala specializata,0.0,0.0,0.0,0%,8622.0,Activitati de asistenta medicala specializata,nan,nan,nan,nan,nan,nan
TRANSILVANIA CASE LEMN SR,40476942,MUREŞ,-,171856,0,0%,1610,Taierea si rindeluirea lemnului,6.0,448303.0,1376.0,0.01%,1610.0,Taierea si rindeluirea lemnului,5.0,125630.0,13665.0,0%,1610.0,Taierea si rindeluirea lemnului,nan,nan,nan,nan,nan,nan
CULTURA SIGHISOREANA SRL,40476900,MUREŞ,-,100595,6003,0%,5911,"Activitati de productie cinematografica, video si de programe de televiziune",4.0,64152.0,0.0,0%,5911.0,"Activitati de productie cinematografica, video si de programe de televiziune",0.0,38500.0,28983.0,0%,5911.0,"Activitati de productie cinematografica, video si de programe de televiziune",nan,nan,nan,nan,nan,nan
SC MYMOB FSK SRL,40477140,MUREŞ,-,652499,105554,0.08%,3102,Fabricarea de mobila pentru bucatarii,3.0,155049.0,0.0,0.02%,3102.0,Fabricarea de mobila pentru bucatarii,0.0,150072.0,28605.0,0.02%,3102.0,Fabricarea de mobila pentru bucatarii,nan,nan,nan,nan,nan,nan
FINAL CLEANING SRL,40477166,MUREŞ,-,33780,8640,0%,8121,Activitati generale (nespecializate) de curatenie interioara a cladirilor,0.0,8200.0,1292.0,0%,8121.0,Activitati generale (nespecializate) de curatenie interioara a cladirilor,0.0,0.0,0.0,0%,8121.0,Activitati generale (nespecializate) de curatenie interioara a cladirilor,nan,nan,nan,nan,nan,nan
PRAJITURE MA SRL,40478552,BRAŞOV,0723588934,42403,0,0.01%,1083,Prelucrarea ceaiului si cafelei,4.0,11882.0,0.0,0%,1083.0,Prelucrarea ceaiului si cafelei,0.0,0.0,0.0,0%,1083.0,Prelucrarea ceaiului si cafelei,nan,nan,nan,nan,nan,nan
S.C.FITNESS URSU SRL,40478609,BRAŞOV,0744774477,233724,0,0.06%,9313,Activitati ale centrelor de fitness,6.0,183186.0,42304.0,0.04%,9313.0,Activitati ale centrelor de fitness,6.0,71890.0,13554.0,0.02%,9313.0,Activitati ale centrelor de fitness,nan,nan,nan,nan,nan,nan
S.C. FIAFIU KFZ S.R.L,40483150,ALBA,-,0,192125,0%,4520,Întretinerea si repararea autovehiculelor,4.0,0.0,0.0,0%,4520.0,Întretinerea si repararea autovehiculelor,0.0,0.0,0.0,0%,4520.0,Întretinerea si repararea autovehiculelor,nan,nan,nan,nan,nan,nan
S.C.AID AUTO SERVICE SRL,40485053,ALBA,-,16436,0,0%,4520,Întretinerea si repararea autovehiculelor,3.0,300.0,0.0,0%,4520.0,Întretinerea si repararea autovehiculelor,nan,nan,nan,nan,nan,nan,nan,nan,nan,nan,nan,nan
